{
  "streams": [
    {
      "id": "rna",
      "label": "Analysis / Slides"
    },
    {
      "id": "cell",
      "label": "Cell Expansion"
    },
    {
      "id": "spheroid",
      "label": "3D Models"
    },
    {
      "id": "flow",
      "label": "Assays / Flow"
    },
    {
      "id": "material",
      "label": "Material Characterization"
    },
    {
      "id": "robot",
      "label": "Motion Tests"
    },
    {
      "id": "mouse",
      "label": "Animal Work"
    },
    {
      "id": "prep",
      "label": "Preparation / Follow-up"
    },
    {
      "id": "general",
      "label": "General"
    }
  ],
  "experiments": [
    {
      "id": "exp-cell-imaging",
      "title": "Anchor Culture Expansion",
      "stream": "cell",
      "goal": "Expand the anchor culture, keep reporter cells healthy, and preserve a cohort-ready window.",
      "steps": [
        {
          "date": "2026-03-15",
          "title_match": "Passage anchor culture for expansion",
          "notes": [
            "Keep one flask as the anchor culture.",
            "Estimate the next passage in about three days."
          ],
          "aliases": [
            "Passage anchor culture for expansion"
          ],
          "task_id": "task-7b1cd17a9d",
          "depends_on": [],
          "hard_timepoint": false,
          "replan_policy": "auto"
        },
        {
          "date": "2026-03-15",
          "title_match": "Expand GFP reporter culture 5 flasks to 10 flasks",
          "notes": [
            "Record total cell count and average per flask.",
            "Mark growth as slower than baseline if the post-thaw increase is modest."
          ],
          "aliases": [
            "Expand GFP reporter culture 5 flasks to 10 flasks"
          ],
          "task_id": "task-5902e4d4b6",
          "depends_on": [
            "task-7b1cd17a9d"
          ],
          "hard_timepoint": false,
          "replan_policy": "auto"
        },
        {
          "date": "2026-03-17",
          "title_match": "If reporter culture is ready: expand to 20 flasks and seed spheroids",
          "decision_rule": "Proceed only if all ten flasks reach the target density at the Tuesday afternoon check.",
          "notes": [
            "If density is still low, keep the conditional card active and push the downstream window."
          ],
          "aliases": [
            "If reporter culture is ready: expand to 20 flasks and seed spheroids"
          ],
          "task_id": "task-976cfa0215",
          "depends_on": [
            "task-5902e4d4b6"
          ],
          "hard_timepoint": false,
          "replan_policy": "conditional"
        }
      ]
    },
    {
      "id": "exp-spheroid",
      "title": "3D Spheroid Pilot",
      "stream": "spheroid",
      "goal": "Seed a ten-well spheroid plate, monitor morphology, then embed compact spheroids in matrix.",
      "steps": [
        {
          "date": "2026-03-15",
          "title_match": "Seed 3D spheroid plates",
          "notes": [
            "Use ten wells with the same starting density.",
            "Capture the seed count in the lab notebook."
          ],
          "aliases": [
            "Seed 3D spheroid plates"
          ],
          "task_id": "task-e114778deb",
          "depends_on": [],
          "hard_timepoint": false,
          "replan_policy": "auto"
        },
        {
          "date": "2026-03-16",
          "title_match": "Check spheroid morphology day 1",
          "notes": [
            "Record whether aggregation is visible in all wells."
          ],
          "aliases": [
            "Check spheroid morphology day 1"
          ],
          "task_id": "task-46a407e005",
          "depends_on": [
            "task-e114778deb"
          ],
          "hard_timepoint": false,
          "replan_policy": "auto"
        },
        {
          "date": "2026-03-18",
          "title_match": "If spheroids are compact: embed in matrix",
          "decision_rule": "Embed only if the spheroids are compact and easy to transfer without breaking.",
          "notes": [
            "If the morphology is weak, keep the plate in suspension and re-check the next day."
          ],
          "aliases": [
            "If spheroids are compact: embed in matrix"
          ],
          "task_id": "task-d6d42fa6f8",
          "depends_on": [
            "task-46a407e005"
          ],
          "hard_timepoint": false,
          "replan_policy": "conditional"
        }
      ]
    },
    {
      "id": "exp-flow",
      "title": "Surface Labeling and Uptake Assay",
      "stream": "flow",
      "goal": "Run labeling and uptake readouts across multiple time points while tracking stability.",
      "steps": [
        {
          "date": "2026-03-16",
          "title_match": "Run 0h surface labeling flow panel",
          "notes": [
            "Run control, dye-only, and metabolically labeled groups."
          ],
          "aliases": [
            "Run 0h surface labeling flow panel"
          ],
          "task_id": "task-719467afe0",
          "depends_on": [],
          "hard_timepoint": true,
          "replan_policy": "manual"
        },
        {
          "date": "2026-03-17",
          "title_match": "Run 24h flow timepoint",
          "notes": [
            "Keep the same gating strategy for comparability."
          ],
          "aliases": [
            "Run 24h flow timepoint"
          ],
          "task_id": "task-bda56d0d97",
          "depends_on": [
            "task-719467afe0"
          ],
          "hard_timepoint": true,
          "replan_policy": "manual"
        },
        {
          "date": "2026-03-20",
          "title_match": "Run 48h flow timepoint",
          "notes": [
            "Archive raw FCS files and note any drift."
          ],
          "aliases": [
            "Run 48h flow timepoint"
          ],
          "task_id": "task-89455a1061",
          "depends_on": [
            "task-bda56d0d97"
          ],
          "hard_timepoint": true,
          "replan_policy": "manual"
        }
      ]
    },
    {
      "id": "exp-material",
      "title": "Material Characterization Follow-up",
      "stream": "material",
      "goal": "Complete sizing first, then return for zeta potential once the instrument slot opens.",
      "steps": [
        {
          "date": "2026-03-12",
          "title_match": "DLS readout",
          "notes": [
            "Capture count rate, diameter distribution, and batch identifier."
          ],
          "aliases": [
            "DLS readout"
          ],
          "task_id": "task-1236ae834d",
          "depends_on": [],
          "hard_timepoint": false,
          "replan_policy": "auto"
        },
        {
          "date": "2026-03-19",
          "title_match": "Zeta potential measurement",
          "notes": [
            "Use the matched buffer condition from the DLS batch."
          ],
          "aliases": [
            "Zeta potential measurement"
          ],
          "task_id": "task-2746567773",
          "depends_on": [
            "task-1236ae834d"
          ],
          "hard_timepoint": false,
          "replan_policy": "auto"
        }
      ]
    },
    {
      "id": "exp-animal",
      "title": "Cohort Readiness Window",
      "stream": "mouse",
      "goal": "Keep the animal start dependent on both cell expansion and cohort availability.",
      "steps": [
        {
          "date": "2026-03-16",
          "title_match": "Confirm animal cohort arrival and cage assignment",
          "notes": [
            "Record cohort size, sex, and housing note."
          ],
          "aliases": [
            "Confirm animal cohort arrival and cage assignment"
          ],
          "task_id": "task-40591f71de",
          "depends_on": [],
          "hard_timepoint": false,
          "replan_policy": "auto"
        },
        {
          "date": "2026-03-23",
          "title_match": "If cells and mice are ready: cohort start",
          "decision_rule": "Only begin if both the expanded cell stock and the animal cohort are available on the same day.",
          "notes": [
            "Use this as a gated readiness window rather than a hard promise."
          ],
          "aliases": [
            "If cells and mice are ready: cohort start"
          ],
          "task_id": "task-6d3a33710e",
          "depends_on": [
            "task-40591f71de"
          ],
          "hard_timepoint": false,
          "replan_policy": "conditional"
        }
      ]
    }
  ],
  "days": [
    {
      "date": "2026-03-15",
      "focus": "Rebuild the wet-lab pipeline after the weekend and preserve the cell-expansion chain.",
      "notes": [
        "Keep the anchor culture alive.",
        "Start the 3D model line without forcing downstream commitments."
      ],
      "tasks": [
        {
          "stream": "spheroid",
          "title_match": "Seed 3D spheroid plates",
          "deliverable": "Ten seeded wells with a consistent cell count.",
          "notes": [
            "Record the target density per well in the notebook."
          ],
          "aliases": [
            "Seed 3D spheroid plates"
          ],
          "task_id": "task-e114778deb",
          "depends_on": [],
          "hard_timepoint": false,
          "replan_policy": "auto"
        },
        {
          "stream": "cell",
          "title_match": "Passage anchor culture for expansion",
          "deliverable": "One anchor flask retained for the next passage window.",
          "aliases": [
            "Passage anchor culture for expansion"
          ],
          "task_id": "task-7b1cd17a9d",
          "depends_on": [],
          "hard_timepoint": false,
          "replan_policy": "auto"
        },
        {
          "stream": "cell",
          "title_match": "Expand GFP reporter culture 5 flasks to 10 flasks",
          "deliverable": "Reporter culture expansion with cell-count note.",
          "aliases": [